{
  "sql": "\n         SELECT \n             u.name,\n             u.email,\n             (SELECT COUNT(*) FROM orders o WHERE o.customer_id = u.id) as order_count,\n             (SELECT MAX(total) FROM orders o WHERE o.customer_id = u.id) as max_order\n         FROM users u\n         WHERE u.id IN (\n             SELECT DISTINCT customer_id \n             FROM orders \n             WHERE order_date >= '2023-01-01'\n         )\n         ",
  "dialect": "trino",
  "chain_type": "downstream",
  "max_depth": "unlimited",
  "actual_max_depth": 1,
  "target_entity": null,
  "chains": {
    "orders": {
      "entity": "orders",
      "entity_type": "table",
      "depth": 0,
      "dependencies": [
        {
          "entity": "QUERY_RESULT",
          "entity_type": "table",
          "depth": 1,
          "dependencies": [],
          "metadata": {
            "table_columns": [
              {
                "name": "(SELECT COUNT(*)",
                "upstream": [
                  "orders.(SELECT COUNT(*)"
                ],
                "type": "DIRECT"
              },
              {
                "name": "order_count",
                "upstream": [],
                "type": "RESULT",
                "transformation": {
                  "source_expression": "(SELECT COUNT(*) FROM orders",
                  "transformation_type": "AGGREGATE",
                  "function_type": "EXPRESSION"
                }
              },
              {
                "name": "max_order",
                "upstream": [],
                "type": "RESULT",
                "transformation": {
                  "source_expression": "(SELECT MAX(total) FROM orders",
                  "transformation_type": "AGGREGATE",
                  "function_type": "EXPRESSION"
                }
              }
            ]
          },
          "transformations": [
            {
              "type": "table_transformation",
              "source_table": "orders",
              "target_table": "QUERY_RESULT",
              "filter_conditions": [
                {
                  "column": "order_date",
                  "operator": ">=",
                  "value": "'2023-01-01'"
                }
              ]
            }
          ]
        }
      ],
      "metadata": {
        "table_type": "TABLE",
        "schema": "default",
        "description": "Customer order transactions",
        "table_columns": [
          {
            "name": "customer_id",
            "upstream": [
              "QUERY_RESULT.max_order",
              "QUERY_RESULT.order_count"
            ],
            "type": "DIRECT"
          },
          {
            "name": "order_date",
            "upstream": [],
            "type": "SOURCE"
          },
          {
            "name": "order_count",
            "upstream": [],
            "type": "RESULT",
            "transformation": {
              "source_expression": "(SELECT COUNT(*) FROM orders",
              "transformation_type": "AGGREGATE",
              "function_type": "EXPRESSION"
            }
          },
          {
            "name": "max_order",
            "upstream": [],
            "type": "RESULT",
            "transformation": {
              "source_expression": "(SELECT MAX(total) FROM orders",
              "transformation_type": "AGGREGATE",
              "function_type": "EXPRESSION"
            }
          }
        ]
      }
    },
    "users": {
      "entity": "users",
      "entity_type": "table",
      "depth": 0,
      "dependencies": [
        {
          "entity": "QUERY_RESULT",
          "entity_type": "table",
          "depth": 1,
          "dependencies": [],
          "metadata": {
            "table_columns": [
              {
                "name": "u.name",
                "upstream": [
                  "users.name"
                ],
                "type": "DIRECT"
              },
              {
                "name": "u.email",
                "upstream": [
                  "users.email"
                ],
                "type": "DIRECT"
              },
              {
                "name": "order_count",
                "upstream": [],
                "type": "RESULT",
                "transformation": {
                  "source_expression": "(SELECT COUNT(*) FROM orders",
                  "transformation_type": "AGGREGATE",
                  "function_type": "EXPRESSION"
                }
              },
              {
                "name": "max_order",
                "upstream": [],
                "type": "RESULT",
                "transformation": {
                  "source_expression": "(SELECT MAX(total) FROM orders",
                  "transformation_type": "AGGREGATE",
                  "function_type": "EXPRESSION"
                }
              }
            ]
          },
          "transformations": [
            {
              "type": "table_transformation",
              "source_table": "users",
              "target_table": "QUERY_RESULT",
              "filter_conditions": [
                {
                  "column": "order_date",
                  "operator": ">=",
                  "value": "'2023-01-01'"
                },
                {
                  "column": "users.id",
                  "operator": "IN",
                  "value": []
                }
              ]
            }
          ]
        }
      ],
      "metadata": {
        "table_type": "TABLE",
        "schema": "default",
        "description": "User profile information",
        "table_columns": [
          {
            "name": "name",
            "upstream": [
              "QUERY_RESULT.name"
            ],
            "type": "DIRECT"
          },
          {
            "name": "email",
            "upstream": [
              "QUERY_RESULT.email"
            ],
            "type": "DIRECT"
          },
          {
            "name": "id",
            "upstream": [
              "QUERY_RESULT.max_order",
              "QUERY_RESULT.order_count"
            ],
            "type": "DIRECT"
          },
          {
            "name": "users.id",
            "upstream": [],
            "type": "SOURCE"
          },
          {
            "name": "order_date",
            "upstream": [],
            "type": "SOURCE"
          },
          {
            "name": "order_count",
            "upstream": [],
            "type": "RESULT",
            "transformation": {
              "source_expression": "(SELECT COUNT(*) FROM orders",
              "transformation_type": "AGGREGATE",
              "function_type": "EXPRESSION"
            }
          },
          {
            "name": "max_order",
            "upstream": [],
            "type": "RESULT",
            "transformation": {
              "source_expression": "(SELECT MAX(total) FROM orders",
              "transformation_type": "AGGREGATE",
              "function_type": "EXPRESSION"
            }
          }
        ]
      }
    }
  },
  "summary": {
    "total_tables": 3,
    "total_columns": 6,
    "has_transformations": true,
    "has_metadata": true,
    "chain_count": 2
  },
  "errors": [],
  "warnings": []
}