{
  "sql": "CREATE TABLE user_summary AS SELECT id, name, COUNT(*) as login_count FROM users GROUP BY id, name",
  "dialect": "trino",
  "chain_type": "downstream",
  "max_depth": "unlimited",
  "actual_max_depth": 1,
  "target_entity": null,
  "chains": {
    "users": {
      "entity": "users",
      "entity_type": "table",
      "depth": 0,
      "dependencies": [
        {
          "entity": "user_summary",
          "entity_type": "table",
          "depth": 1,
          "dependencies": [],
          "metadata": {
            "table_columns": [
              {
                "name": "name",
                "upstream": [],
                "type": "SOURCE"
              },
              {
                "name": "id",
                "upstream": [],
                "type": "SOURCE"
              },
              {
                "name": "login_count",
                "upstream": [],
                "type": "RESULT",
                "transformation": {
                  "source_expression": "COUNT(*)",
                  "transformation_type": "AGGREGATE",
                  "function_type": "COUNT"
                }
              }
            ]
          },
          "transformations": [
            {
              "type": "table_transformation",
              "source_table": "users",
              "target_table": "user_summary",
              "group_by_columns": [
                "id",
                "name"
              ]
            }
          ]
        }
      ],
      "metadata": {
        "table_type": "TABLE",
        "schema": "default",
        "description": "User profile information",
        "table_columns": [
          {
            "name": "name",
            "upstream": [],
            "type": "SOURCE"
          },
          {
            "name": "id",
            "upstream": [],
            "type": "SOURCE"
          },
          {
            "name": "login_count",
            "upstream": [],
            "type": "RESULT",
            "transformation": {
              "source_expression": "COUNT(*)",
              "transformation_type": "AGGREGATE",
              "function_type": "COUNT"
            }
          }
        ]
      }
    }
  },
  "summary": {
    "total_tables": 2,
    "total_columns": 2,
    "has_transformations": true,
    "has_metadata": true,
    "chain_count": 1
  },
  "errors": [],
  "warnings": []
}