{
  "sql": "\n         CREATE TABLE user_summary AS\n         SELECT id, name, age, COUNT(*) as login_count\n         FROM users\n         WHERE age >= 18\n         GROUP BY id, name, age\n         ",
  "dialect": "trino",
  "chain_type": "downstream",
  "max_depth": "unlimited",
  "actual_max_depth": 1,
  "target_entity": null,
  "chains": {
    "users": {
      "entity": "users",
      "entity_type": "table",
      "depth": 0,
      "dependencies": [
        {
          "entity": "user_summary",
          "entity_type": "table",
          "depth": 1,
          "dependencies": [],
          "metadata": {
            "table_columns": [
              {
                "name": "age",
                "upstream": [],
                "type": "SOURCE"
              },
              {
                "name": "name",
                "upstream": [],
                "type": "SOURCE"
              },
              {
                "name": "id",
                "upstream": [],
                "type": "SOURCE"
              },
              {
                "name": "login_count",
                "upstream": [],
                "type": "RESULT",
                "transformation": {
                  "source_expression": "COUNT(*)",
                  "transformation_type": "AGGREGATE",
                  "function_type": "COUNT"
                }
              }
            ]
          },
          "transformations": [
            {
              "type": "table_transformation",
              "source_table": "users",
              "target_table": "user_summary",
              "filter_conditions": [
                {
                  "column": "age",
                  "operator": ">=",
                  "value": "18"
                }
              ],
              "group_by_columns": [
                "id",
                "name",
                "age"
              ]
            }
          ]
        }
      ],
      "metadata": {
        "table_type": "TABLE",
        "schema": "default",
        "description": "User profile information",
        "table_columns": [
          {
            "name": "age",
            "upstream": [],
            "type": "SOURCE"
          },
          {
            "name": "name",
            "upstream": [],
            "type": "SOURCE"
          },
          {
            "name": "id",
            "upstream": [],
            "type": "SOURCE"
          },
          {
            "name": "login_count",
            "upstream": [],
            "type": "RESULT",
            "transformation": {
              "source_expression": "COUNT(*)",
              "transformation_type": "AGGREGATE",
              "function_type": "COUNT"
            }
          }
        ]
      }
    }
  },
  "summary": {
    "total_tables": 2,
    "total_columns": 3,
    "has_transformations": true,
    "has_metadata": true,
    "chain_count": 1
  },
  "errors": [],
  "warnings": []
}